{
  "schema": "simplicio.plugin.context-handle/v2",
  "status": "ready",
  "context_id": "sha256:aaaaaaaaaaaaaaaaaaaaaaaaaaaaaaaaaaaaaaaaaaaaaaaaaaaaaaaaaaaaaaaa",
  "handle": "sha256:aaaaaaaaaaaaaaaaaaaaaaaaaaaaaaaaaaaaaaaaaaaaaaaaaaaaaaaaaaaaaaaa",
  "producer": {
    "component": "simplicio-mapper",
    "version": "0.26.25",
    "commit": "cefbd739b9ab86b7a842637b61da7bac96e48552",
    "artifact_digest": null
  },
  "generation": {
    "schema": "simplicio.repository-generation/v2",
    "id": "sha256:bbbbbbbbbbbbbbbbbbbbbbbbbbbbbbbbbbbbbbbbbbbbbbbbbbbbbbbbbbbbbbbb",
    "scope": "working_tree",
    "dirty_content_included": false
  },
  "local_map_cache": {
    "scope": "local_mapper_artifact",
    "layer": "mapper_l1",
    "status": "miss",
    "key": "sha256:cccccccccccccccccccccccccccccccccccccccccccccccccccccccccccccccc",
    "reason": "cache_miss"
  },
  "coverage": {
    "status": "complete",
    "truncated": false,
    "omitted_count": 0
  },
  "provider_prompt_cache": null,
  "spans": [],
  "provenance": [],
  "digest": "dddddddddddddddddddddddddddddddddddddddddddddddddddddddddddddddd"
}
